{"schemaVersion":1,"indicator":{"id":"ER.H2O.FWST.ZS","label":"Level of water stress: freshwater withdrawal as a proportion of available freshwater resources","unit":"%","sdg":"6.4.2","sourceId":"S30","source":"FAO AQUASTAT, through the World Bank API (World Development Indicators)","lastUpdated":"2026-10-08","classSource":"FAO and UN-Water, SDG indicator 6.4.2 level of water stress: no stress below 25 %, low 25-50 %, medium 50-75 %, high 75-100 %, critical above 100 % (Progress on Level of Water Stress, 2021)","classRule":"A value on a threshold takes the higher class (25 % is low), except 100 %, which is high: critical means withdrawals above 100 % of available freshwater resources.","classes":[{"id":"none","label":"No stress","min":0,"max":25},{"id":"low","label":"Low","min":25,"max":50},{"id":"medium","label":"Medium","min":50,"max":75},{"id":"high","label":"High","min":75,"max":100},{"id":"critical","label":"Critical","min":100,"max":null}],"scope":"A national figure: it describes total freshwater withdrawals against renewable resources for the whole country. It says nothing about the region where a crop is grown, the season, or whether the produce the UK imports is irrigated."},"countries":[{"iso2":"AF","iso3":"AFG","name":"Afghanistan","year":2022,"value":54.757,"class":"medium","series":[[2000,54.757],[2001,54.757],[2002,54.757],[2003,54.757],[2004,54.757],[2005,54.757],[2006,54.757],[2007,54.757],[2008,54.757],[2009,54.757],[2010,54.757],[2011,54.757],[2012,54.757],[2013,54.757],[2014,54.757],[2015,54.757],[2016,54.757],[2017,54.757],[2018,54.757],[2019,54.757],[2020,54.757],[2021,54.757],[2022,54.757]]},{"iso2":"AO","iso3":"AGO","name":"Angola","year":2022,"value":1.872,"class":"none","series":[[2000,1.699],[2001,1.733],[2002,1.768],[2003,1.803],[2004,1.837],[2005,1.872],[2006,1.872],[2007,1.872],[2008,1.872],[2009,1.872],[2010,1.872],[2011,1.872],[2012,1.872],[2013,1.872],[2014,1.872],[2015,1.872],[2016,1.872],[2017,1.872],[2018,1.872],[2019,1.872],[2020,1.872],[2021,1.872],[2022,1.872]]},{"iso2":"AL","iso3":"ALB","name":"Albania","year":2022,"value":4.79,"class":"none","series":[[2000,11.044],[2001,10.52],[2002,9.995],[2003,9.47],[2004,8.945],[2005,8.42],[2006,7.647],[2007,7.498],[2008,7.35],[2009,7.202],[2010,7.053],[2011,6.905],[2012,6.757],[2013,6.609],[2014,6.46],[2015,5.529],[2016,6.562],[2017,6.556],[2018,5.757],[2019,6.797],[2020,4.724],[2021,4.784],[2022,4.79]]},{"iso2":"AE","iso3":"ARE","name":"United Arab Emirates","year":2022,"value":1509.933,"class":"critical","series":[[2000,1555.867],[2001,1527.929],[2002,1499.991],[2003,1472.053],[2004,1669.36],[2005,1866.667],[2006,1849.636],[2007,1832.606],[2008,1815.576],[2009,1798.545],[2010,1781.515],[2011,1764.485],[2012,1747.455],[2013,1730.424],[2014,1713.394],[2015,1696.364],[2016,1679.333],[2017,1630.0],[2018,1667.333],[2019,1628.667],[2020,1587.333],[2021,1533.333],[2022,1509.933]]},{"iso2":"AR","iso3":"ARG","name":"Argentina","year":2022,"value":10.457,"class":"none","series":[[2000,8.425],[2001,8.61],[2002,8.794],[2003,8.979],[2004,9.164],[2005,9.348],[2006,9.533],[2007,9.718],[2008,9.902],[2009,10.087],[2010,10.272],[2011,10.457],[2012,10.457],[2013,10.457],[2014,10.457],[2015,10.457],[2016,10.457],[2017,10.457],[2018,10.457],[2019,10.457],[2020,10.457],[2021,10.457],[2022,10.457]]},{"iso2":"AM","iso3":"ARM","name":"Armenia","year":2022,"value":61.973,"class":"medium","series":[[2000,37.745],[2001,34.819],[2002,34.961],[2003,39.863],[2004,50.494],[2005,55.901],[2006,57.03],[2007,60.763],[2008,57.958],[2009,49.707],[2010,42.909],[2011,49.183],[2012,59.33],[2013,59.613],[2014,57.696],[2015,65.987],[2016,64.172],[2017,57.898],[2018,54.751],[2019,57.797],[2020,57.091],[2021,59.855],[2022,61.973]]},{"iso2":"AG","iso3":"ATG","name":"Antigua and Barbuda","year":2022,"value":8.462,"class":"none","series":[[2000,7.628],[2001,8.064],[2002,8.5],[2003,8.936],[2004,9.372],[2005,9.808],[2006,9.615],[2007,9.423],[2008,9.231],[2009,9.038],[2010,8.846],[2011,8.654],[2012,8.462],[2013,8.462],[2014,8.462],[2015,8.462],[2016,8.462],[2017,8.462],[2018,8.462],[2019,8.462],[2020,8.462],[2021,8.462],[2022,8.462]]},{"iso2":"AU","iso3":"AUS","name":"Australia","year":2022,"value":4.672,"class":"none","series":[[2000,8.709],[2001,8.659],[2002,8.377],[2003,8.096],[2004,7.814],[2005,7.532],[2006,7.059],[2007,6.586],[2008,6.113],[2009,5.64],[2010,5.298],[2011,5.314],[2012,6.38],[2013,7.699],[2014,7.424],[2015,3.707],[2016,4.271],[2017,4.849],[2018,4.958],[2019,4.246],[2020,3.37],[2021,4.447],[2022,4.672]]},{"iso2":"AT","iso3":"AUT","name":"Austria","year":2022,"value":8.676,"class":"none","series":[[2000,10.047],[2001,9.967],[2002,9.884],[2003,9.854],[2004,9.824],[2005,9.794],[2006,9.764],[2007,9.734],[2008,9.704],[2009,9.674],[2010,9.644],[2011,9.536],[2012,9.429],[2013,9.321],[2014,9.214],[2015,9.106],[2016,8.999],[2017,8.891],[2018,8.784],[2019,8.676],[2020,8.676],[2021,8.676],[2022,8.676]]},{"iso2":"AZ","iso3":"AZE","name":"Azerbaijan","year":2022,"value":57.527,"class":"medium","series":[[2000,48.532],[2001,43.82],[2002,43.802],[2003,46.447],[2004,49.349],[2005,52.109],[2006,53.628],[2007,53.367],[2008,50.916],[2009,49.194],[2010,48.443],[2011,49.883],[2012,52.881],[2013,52.965],[2014,51.19],[2015,51.618],[2016,52.453],[2017,53.522],[2018,53.729],[2019,55.597],[2020,53.889],[2021,57.266],[2022,57.527]]},{"iso2":"BI","iso3":"BDI","name":"Burundi","year":2022,"value":10.193,"class":"none","series":[[2000,10.48],[2001,10.423],[2002,10.365],[2003,10.308],[2004,10.25],[2005,10.193],[2006,10.193],[2007,10.193],[2008,10.193],[2009,10.193],[2010,10.193],[2011,10.193],[2012,10.193],[2013,10.193],[2014,10.193],[2015,10.193],[2016,10.193],[2017,10.193],[2018,10.193],[2019,10.193],[2020,10.193],[2021,10.193],[2022,10.193]]},{"iso2":"BE","iso3":"BEL","name":"Belgium","year":2022,"value":52.826,"class":"medium","series":[[2000,92.544],[2001,87.646],[2002,82.748],[2003,81.317],[2004,79.885],[2005,78.453],[2006,77.4],[2007,76.346],[2008,75.295],[2009,73.735],[2010,73.133],[2011,62.432],[2012,65.111],[2013,59.324],[2014,55.971],[2015,49.066],[2016,51.512],[2017,53.957],[2018,51.29],[2019,51.585],[2020,52.17],[2021,52.826],[2022,52.826]]},{"iso2":"BJ","iso3":"BEN","name":"Benin","year":2022,"value":0.975,"class":"none","series":[[2000,1.0],[2001,0.975],[2002,0.975],[2003,0.975],[2004,0.975],[2005,0.975],[2006,0.975],[2007,0.975],[2008,0.975],[2009,0.975],[2010,0.975],[2011,0.975],[2012,0.975],[2013,0.975],[2014,0.975],[2015,0.975],[2016,0.975],[2017,0.975],[2018,0.975],[2019,0.975],[2020,0.975],[2021,0.975],[2022,0.975]]},{"iso2":"BF","iso3":"BFA","name":"Burkina Faso","year":2022,"value":7.82,"class":"none","series":[[2000,6.195],[2001,6.52],[2002,6.845],[2003,7.17],[2004,7.495],[2005,7.82],[2006,7.82],[2007,7.82],[2008,7.82],[2009,7.82],[2010,7.82],[2011,7.82],[2012,7.82],[2013,7.82],[2014,7.82],[2015,7.82],[2016,7.82],[2017,7.82],[2018,7.82],[2019,7.82],[2020,7.82],[2021,7.82],[2022,7.82]]},{"iso2":"BD","iso3":"BGD","name":"Bangladesh","year":2022,"value":5.723,"class":"none","series":[[2008,5.723],[2009,5.723],[2010,5.723],[2011,5.723],[2012,5.723],[2013,5.723],[2014,5.723],[2015,5.723],[2016,5.723],[2017,5.723],[2018,5.723],[2019,5.723],[2020,5.723],[2021,5.723],[2022,5.723]]},{"iso2":"BG","iso3":"BGR","name":"Bulgaria","year":2022,"value":40.235,"class":"low","series":[[2000,45.33],[2001,43.118],[2002,48.701],[2003,48.129],[2004,47.557],[2005,46.985],[2006,46.413],[2007,45.841],[2008,47.491],[2009,45.238],[2010,44.054],[2011,47.195],[2012,42.24],[2013,40.417],[2014,39.737],[2015,41.61],[2016,42.05],[2017,41.821],[2018,40.099],[2019,40.077],[2020,36.729],[2021,38.525],[2022,40.235]]},{"iso2":"BH","iso3":"BHR","name":"Bahrain","year":2022,"value":133.707,"class":"critical","series":[[2000,248.911],[2001,234.762],[2002,220.614],[2003,205.776],[2004,201.105],[2005,196.434],[2006,191.763],[2007,187.092],[2008,182.422],[2009,177.751],[2010,173.08],[2011,168.409],[2012,163.738],[2013,159.067],[2014,154.397],[2015,137.155],[2016,133.707],[2017,133.707],[2018,133.707],[2019,133.707],[2020,133.707],[2021,133.707],[2022,133.707]]},{"iso2":"BA","iso3":"BIH","name":"Bosnia and Herzegovina","year":2022,"value":2.072,"class":"none","series":[[2000,2.469],[2001,2.481],[2002,2.493],[2003,2.506],[2004,2.517],[2005,2.515],[2006,2.526],[2007,2.587],[2008,2.602],[2009,2.855],[2010,2.891],[2011,2.813],[2012,2.906],[2013,2.894],[2014,2.738],[2015,2.779],[2016,2.786],[2017,2.662],[2018,2.072],[2019,2.029],[2020,2.001],[2021,2.032],[2022,2.072]]},{"iso2":"BY","iso3":"BLR","name":"Belarus","year":2022,"value":4.661,"class":"none","series":[[2000,6.055],[2001,5.968],[2002,5.882],[2003,5.796],[2004,5.709],[2005,5.623],[2006,5.519],[2007,5.415],[2008,5.31],[2009,5.206],[2010,5.102],[2011,5.065],[2012,5.027],[2013,4.99],[2014,5.178],[2015,4.773],[2016,4.782],[2017,4.614],[2018,4.581],[2019,4.476],[2020,4.377],[2021,4.697],[2022,4.661]]},{"iso2":"BZ","iso3":"BLZ","name":"Belize","year":2022,"value":1.26,"class":"none","series":[[2000,1.26],[2001,1.26],[2002,1.26],[2003,1.26],[2004,1.26],[2005,1.26],[2006,1.26],[2007,1.26],[2008,1.26],[2009,1.26],[2010,1.26],[2011,1.26],[2012,1.26],[2013,1.26],[2014,1.26],[2015,1.26],[2016,1.26],[2017,1.26],[2018,1.26],[2019,1.26],[2020,1.26],[2021,1.26],[2022,1.26]]},{"iso2":"BO","iso3":"BOL","name":"Bolivia","year":2022,"value":0.203,"class":"none","series":[[2000,1.109],[2001,1.118],[2002,1.126],[2003,1.135],[2004,1.143],[2005,1.152],[2006,1.16],[2007,1.169],[2008,1.177],[2009,1.177],[2010,1.184],[2011,1.19],[2012,1.197],[2013,1.203],[2014,1.21],[2015,1.216],[2016,1.223],[2017,1.229],[2018,1.236],[2019,1.243],[2020,0.207],[2021,0.203],[2022,0.203]]},{"iso2":"BR","iso3":"BRA","name":"Brazil","year":2022,"value":1.496,"class":"none","series":[[2000,2.653],[2001,2.668],[2002,2.683],[2003,2.698],[2004,2.713],[2005,2.729],[2006,2.744],[2007,2.942],[2008,3.14],[2009,3.337],[2010,3.535],[2011,3.419],[2012,3.303],[2013,3.187],[2014,3.074],[2015,3.019],[2016,3.135],[2017,3.10